{
  "$schema": "http://json-schema.org/draft-07/schema#",
  "title": "Wiki configuration",
  "description": "Per-wiki branding and behavior. Edit directly or run `npm run init`.",
  "type": "object",
  "additionalProperties": false,
  "required": [
    "title",
    "tagline",
    "url",
    "organizationName",
    "projectName",
    "copyright",
    "noindex",
    "description"
  ],
  "properties": {
    "$schema": {
      "type": "string"
    },
    "title": {
      "type": "string",
      "description": "Site title and navbar label"
    },
    "tagline": {
      "type": "string",
      "description": "One-line site tagline"
    },
    "url": {
      "type": "string",
      "description": "Production URL with protocol. MUST be the host that serves 200 DIRECTLY, not one that redirects: Docusaurus turns this into every absolute URL the site emits (og:image, og:url, canonical), and a scraper that does not follow a redirect drops the share card entirely."
    },
    "organizationName": {
      "type": "string",
      "description": "GitHub org/user"
    },
    "projectName": {
      "type": "string",
      "description": "GitHub repo name"
    },
    "copyright": {
      "type": "string",
      "description": "Footer copyright text"
    },
    "noindex": {
      "type": "boolean",
      "description": "If true, robots noindex meta + disable sitemap"
    },
    "description": {
      "type": "string",
      "description": "Site description used in llms.txt header"
    },
    "retired_words": {
      "type": "object",
      "description": "Words the operator has retired on purpose. The build refuses any live page that uses one. Match is on the bare word, case-insensitive; `use` is printed with every hit.",
      "properties": {
        "words": {
          "type": "array",
          "items": {
            "type": "object",
            "required": [
              "name",
              "pattern",
              "since",
              "use"
            ],
            "properties": {
              "name": {
                "type": "string"
              },
              "pattern": {
                "type": "string"
              },
              "since": {
                "type": "string"
              },
              "use": {
                "type": "string"
              }
            }
          }
        },
        "exempt": {
          "type": "array",
          "items": {
            "type": "string"
          }
        }
      },
      "required": [
        "words"
      ]
    },
    "gate": {
      "type": "object",
      "additionalProperties": false,
      "description": "How this wiki is gated. Read at the edge by createMiddlewareFromConfig (middleware.ts) and by `pnpm share`. Absent means the family password gate, dark until WIKI_PASSWORD and WIKI_GATE_SECRET are set on the project.",
      "properties": {
        "type": {
          "type": "string",
          "enum": [
            "password",
            "freedom-account",
            "none"
          ],
          "description": "`password` (the default): the family password gate, opened by WIKI_PASSWORD. `freedom-account`: for people running Freedom; a stranger signs in through the Freedom portal with Google and an active account comes back with a pass; WIKI_PASS_SECRET (or WIKI_GATE_SECRET) must match the portal's, and a password on the project opens nothing. `none`: never gated, whatever the project holds."
        },
        "unlockParam": {
          "type": [
            "string",
            "null"
          ],
          "description": "The query parameter that carries the credential in a prefilled link. Defaults by type: `key` for a password, `k` (the portal's hourly account key) for freedom-account. null declares that no query-string unlock exists, so `pnpm share` never builds one."
        },
        "machinePaths": {
          "type": "string",
          "enum": [
            "open",
            "gated"
          ],
          "description": "Password gate only. `open` (default) serves .md, .txt, audio, video, .pdf and /llms.txt with the gate on, for agents and players that cannot answer a door. `gated` puts them behind it too: right for a private wiki, whose /llms-full.txt is its whole text in one file."
        },
        "signInUrl": {
          "type": "string",
          "description": "freedom-account only. The portal page that signs a reader in and bounces them back with a pass. Default https://freedom.continentalworks.ai/wiki/sign-in."
        },
        "openPaths": {
          "type": "string",
          "description": "freedom-account only. A regular expression (source text, case-insensitive) of paths served with no sign-in. REPLACES the default (hosted skills and generators, llms.txt, .md/.txt/media/.pdf); use it on a wiki whose /skills/ prefix is a docs reference and only the .md files under it are for agents."
        },
        "allowEnv": {
          "type": "string",
          "description": "freedom-account only. The NAME of an environment variable holding the account ids allowed in, comma-separated (e.g. WIKI_ALLOWED_ACCOUNTS). Set: only those accounts are admitted, and an empty or missing variable admits nobody. Absent: every active account is admitted. The ids live in the deployment, never in this file."
        },
        "shareAdminsEnv": {
          "type": "string",
          "description": "freedom-account only. The NAME of an environment variable holding the account ids that may make one-page share links, comma-separated (e.g. WIKI_SHARE_ADMINS). Set: only those accounts get a link from the Share button, and an empty or missing variable lets nobody make one. Absent: every admitted reader can. Links already made keep opening."
        },
        "grantDays": {
          "type": "number",
          "description": "freedom-account only. How long one sign-in lasts. Default 7."
        },
        "door": {
          "type": "object",
          "additionalProperties": false,
          "description": "freedom-account only. The sign-in door's own words, for a wiki that is not early access (a team or client wiki), and its look. Plain text. Absent: the early-access wording on the neutral card.",
          "properties": {
            "heading": { "type": "string" },
            "body": { "type": "string" },
            "theme": {
              "enum": ["neutral", "ascent", "maison"],
              "description": "The door's look. neutral (default): a plain card naming no one. maison: the Maison, stone in light mode and night in dark mode by the reader's phone, DM Serif Display over DM Sans, for a wiki that wears the Maison (the Supersuit Wiki). ascent: the archived Continental Works look (six-stripe ribbon, Fraunces, mulberry action), kept for a wiki not yet moved."
            }
          }
        },
        "title": {
          "type": "string",
          "description": "What the door calls the wiki. Defaults to the request host."
        }
      }
    },
    "analytics": {
      "description": "Reader analytics: who reads which page, told from the edge (src/analytics/reads.ts). Absent or true: a freedom-account wiki reports to its own portal (<origin of gate.signInUrl>/api/wiki-reads), any other wiki sends nothing unless WIKI_ANALYTICS_URL is set. false: nothing is ever sent. An object names the sink. Events carry the page, the reader the signed grant names (or key, password, anonymous, share), country and mobile/desktop; never an IP or a raw user agent.",
      "oneOf": [
        {
          "type": "boolean"
        },
        {
          "type": "object",
          "additionalProperties": false,
          "properties": {
            "endpoint": {
              "type": "string",
              "format": "uri",
              "description": "Where signed events are POSTed (header x-wiki-read-sig). WIKI_ANALYTICS_URL on the project overrides it."
            }
          }
        }
      ]
    },
    "hero_register": {
      "type": "object",
      "additionalProperties": false,
      "description": "How this wiki's article heroes get made. `mode` picks the engine and nothing else about a page changes when it moves: both engines emit the same five artifacts (deploy WebP, source PNG, provenance recipe beside the WebP, verbatim-prompt alt text, frontmatter image), so a wiki graduates from local to abu by editing one field.",
      "properties": {
        "mode": {
          "type": "string",
          "enum": [
            "local",
            "abu"
          ],
          "description": "local: the vendored generator at illustrations/scripts/, no ABU install needed. abu: the shared wiki-article-hero form, via abu:make-a-work. Absent means abu, so wikis predating this field keep working."
        },
        "layout": {
          "type": "string",
          "enum": [
            "multipanel",
            "single"
          ],
          "description": "multipanel is the default. A hero is a strip of beats; one plate is the exception."
        },
        "defaultPanels": {
          "type": "integer",
          "minimum": 2,
          "maximum": 6,
          "description": "Beats per hero when layout is multipanel. 3 is the default."
        },
        "register": {
          "type": "string",
          "description": "One sentence naming the visual register, passed first on every render. Never name a living or recent illustrator; OpenAI moderation hard-blocks those. Describe the tradition instead."
        },
        "spec": {
          "type": "string",
          "description": "Path to the fuller visual spec. Prose for humans and agents; the register string above is what actually reaches the model."
        },
        "refs": {
          "type": "array",
          "items": {
            "type": "string"
          },
          "description": "Blessed style references, all passed on every render. 2 to 4 is enough to lock a look without a recurring character."
        },
        "outputDir": {
          "type": "string",
          "description": "Where deploy assets land. Default static/img/illustrations."
        },
        "universe": {
          "type": "string",
          "description": "mode abu only. Path to the universe supplying the register and cast."
        },
        "form": {
          "type": "string",
          "description": "mode abu only. The form id, normally wiki-article-hero."
        },
        "stylePack": {
          "type": "string",
          "description": "mode abu only. Style pack path within the universe."
        },
        "characterRef": {
          "type": "string",
          "description": "mode abu only. Locked character master."
        },
        "motifRefs": {
          "type": "array",
          "items": {
            "type": "string"
          },
          "description": "mode abu only. Locked motif plates."
        }
      }
    },
    "hero": {
      "type": "object",
      "additionalProperties": false,
      "description": "How `wiki hero` makes this wiki's article heroes: a shared Style Pack paints them, the wiki-layer laws (one image of N equal panels in a row or a two-by-two grid, cream gutters, no borders, a title bar and one label band per panel and no other text) shape them. Supersedes `hero_register`, which `wiki hero` migrates in memory when this block is absent.",
      "required": [
        "stylePack"
      ],
      "properties": {
        "stylePack": {
          "type": "string",
          "description": "The Style Pack that paints the heroes: a path to a pack folder (holding pack.json and refs/), or a bare id looked up in $WIKI_STYLE_PACKS and then ../wiki-style-packs/packs beside the wiki."
        },
        "layout": {
          "type": "string",
          "enum": [
            "row",
            "grid"
          ],
          "description": "row: the beats left to right in one horizontal strip. grid: exactly four beats in two columns and two rows, read left to right then top to bottom. Default grid."
        },
        "beats": {
          "type": "integer",
          "minimum": 2,
          "maximum": 6,
          "description": "Panels per hero. Default 4. A grid holds exactly four."
        },
        "size": {
          "type": "string",
          "pattern": "^[0-9]+x[0-9]+$",
          "description": "WIDTHxHEIGHT, both divisible by 16. Default 2560x1440."
        },
        "model": {
          "type": "string",
          "description": "Image model id. Default gpt-image-2.5-sunburst."
        },
        "quality": {
          "type": "string",
          "description": "Model quality tier. Default xhigh."
        },
        "tier": {
          "type": "string",
          "enum": [
            "best",
            "fast"
          ],
          "description": "The tier `wiki hero` renders at when no --tier flag is given. best: hero.model at hero.quality and hero.size. fast: the cheaper draft model at the draft size. Default best."
        },
        "outputDir": {
          "type": "string",
          "description": "Where the deploy WebP, the source PNG and the provenance recipe land. Default static/img/illustrations."
        },
        "props": {
          "type": "object",
          "additionalProperties": {
            "oneOf": [
              {
                "type": "array",
                "minItems": 1,
                "items": {
                  "type": "string"
                }
              },
              {
                "type": "object",
                "additionalProperties": false,
                "required": [
                  "refs"
                ],
                "properties": {
                  "refs": {
                    "type": "array",
                    "minItems": 1,
                    "items": {
                      "type": "string"
                    },
                    "description": "The prop's photographs, paths relative to the wiki root."
                  },
                  "gate": {
                    "type": "array",
                    "items": {
                      "type": "string"
                    },
                    "description": "Read-back assertions about this prop, one per string, checked only on a render that passes the prop. A prop-specific truth lives here, never in the wiki-wide gate."
                  }
                }
              }
            ]
          },
          "description": "Objects that must be drawn accurately, by name: each maps to one or more photographs (paths relative to the wiki root), or to { refs, gate } when the prop carries its own read-back lines. A page opts in with `wiki hero --prop <name>`; the photos are passed after the style refs and named as props so the model copies the object, never the photograph, and the prop's gate joins the read-back for that render only."
        },
        "gate": {
          "type": "array",
          "items": {
            "type": "string"
          },
          "description": "Read-back assertions true of every hero this wiki makes, one per string, checked after the wiki-layer defaults and the pack's own gate. A line about one prop belongs on that prop's gate; a line about how a recurring subject is always shown belongs in the pack's pairings."
        }
      }
    },
    "intake_mode": {
      "type": "string",
      "enum": [
        "source-grounded",
        "authored-canon"
      ],
      "description": "How this wiki grows. source-grounded: fold in external sources faithfully with citation. authored-canon: author net-new original philosophy that coheres with the canon. Drives which intake skill scripts/init-intake-skill.sh scaffolds into static/skills/."
    },
    "skill_prefix": {
      "type": "string",
      "description": "Namespace for this wiki's skills when registered into the global registry (e.g. 'humanperformance' -> humanperformance-intake). Defaults to projectName minus a trailing -wiki. Used by scripts/register-skills.sh."
    },
    "og": {
      "type": "object",
      "additionalProperties": false,
      "description": "Brand tokens for the auto-generated per-page social share cards (plugins/og-image-plugin). Every page without a frontmatter `image:` hero gets a card built from these at build time. Omit for the template defaults.",
      "properties": {
        "bg": {
          "type": "string",
          "description": "Card background color (hex)"
        },
        "accent": {
          "type": "string",
          "description": "Accent color for the kicker and bar (hex)"
        },
        "text": {
          "type": "string",
          "description": "Title text color (hex)"
        },
        "muted": {
          "type": "string",
          "description": "Description/domain text color (hex)"
        }
      }
    },
    "matcher": {
      "type": "string",
      "enum": [
        "default",
        "skills-are-pages"
      ],
      "description": "Which middleware matcher literal middleware.ts must carry (`wiki check middleware` refuses any other). `default` (or absent) is the family matcher, which skips /skills/ and /generators/ wholesale because they hold agent files. `skills-are-pages` is for a gated wiki whose /skills/* routes are DOCS PAGES: it lets them reach the gate and skips only .md, llms.txt and llms-full.txt."
    },
    "llms_preamble": {
      "type": "string",
      "description": "A paragraph for the agent that opens llms.txt and llms-full.txt, before the index: what this tree is and in what order to read it."
    },
    "llms_sections": {
      "type": "array",
      "items": {
        "type": "string"
      },
      "description": "Top-level folders of docs/ in the order an agent should read them in llms.txt and llms-full.txt. Folders not named still appear, after these, alphabetically."
    }
  }
}
